"platform","keyword","text","score","post_id","created_utc","timestamp","date","sentiment_score"
"Religion","BuddhaGPT","15. Not Mind. Not Buddha. Not a Thing. | Miaozong's verses translated with ChatGPT 4",7,"https://www.reddit.com/r/zen/comments/1982xsi/15_not_mind_not_buddha_not_a_thing_miaozongs/",1705411834,2024-01-16 05:30:34,2024-01-16,NA
"Religion","Buddhist AI chatbot","[TOMT][Website][2000s-2010s???] Weird AI chatbot. Help me get it out of my head!!!!!!",3,"https://www.reddit.com/r/tipofmytongue/comments/1fj5hiw/tomtwebsite2000s2010s_weird_ai_chatbot_help_me/",1726594591,2024-09-17 10:36:31,2024-09-17,-3
"Religion","Buddhist AI chatbot","It's Becoming Increasingly Clear to Me We're in the ""Dharma Ending Age""",167,"https://www.reddit.com/r/enlightenment/comments/1hefurr/its_becoming_increasingly_clear_to_me_were_in_the/",1734220013,2024-12-14 15:46:53,2024-12-14,NA
"Religion","Buddhist AI chatbot","New Beta Chatbot for Meditation Assessment &amp; Advanced AI Meditation Teacher",1,"https://www.reddit.com/r/Meditation/comments/161aebf/new_beta_chatbot_for_meditation_assessment/",1692995699,2023-08-25 13:34:59,2023-08-25,3
"Religion","Buddhist AI chatbot","I think in times where chatbots and AI are used so much, that message is important... Especially in times like this.",39736,"https://i.redd.it/0uisek0f33le1.jpeg",1740401570,2025-02-24 04:52:50,2025-02-24,NA
"Religion","Buddhist AI chatbot","Elon Musk's AI chatbot says a 'Russian asset' delivered the State of the Union | Opinion — The chatbot Grok scoured available public data and found a '75-85% likelihood' that Donald Trump more or less works for Vladimir Putin.",39856,"https://www.usatoday.com/story/opinion/op-ed/ej-montini/2025/03/05/trump-speech-state-union-russia-elon-musk-grok/81507335007/",1741204599,2025-03-05 11:56:39,2025-03-05,3
"Religion","Buddhist AI chatbot","DOGE is reportedly developing an AI chatbot to analyse government contracts",6024,"https://mashable.com/article/doge-ai-chatbot-gsa-government?campaign=Mash-BD-Synd-SmartNews-All&amp;mpp=false&amp;supported=false",1738927838,2025-02-07 03:30:38,2025-02-07,NA
"Religion","Buddhist AI chatbot","Ex-Google CEO warns that 'perfect' AI girlfriends could spell trouble for young men | Some are crafting their perfect AI match and entering relationships with chatbots.",6576,"https://www.businessinsider.com/ex-google-eric-schmidt-ai-girlfriends-young-men-concerns-2024-11",1732972617,2024-11-30 05:16:57,2024-11-30,3
"Religion","Buddhist AI chatbot","A 32-year-old receptionist spent years working at a Phoenix hotel. Then it installed AI chatbots and made her job obsolete.",5662,"https://fortune.com/2025/02/11/32-year-old-receptionist-spent-years-working-phoenix-hotel-then-ai-chatbots-made-her-job-obsolete/",1739384284,2025-02-12 10:18:04,2025-02-12,-3
"Religion","Buddhist AI chatbot","Daisy, the AI chatbot, mimics elderly victims to thwart scammers, keeping them occupied during calls and wasting their time.",39534,"https://i.redd.it/16daz70k8k1e1.jpeg",1731892155,2024-11-17 17:09:15,2024-11-18,-6
"Religion","Buddhist AI chatbot","Google and Microsoft’s AI Chatbots Refuse to Say Who Won the 2020 US Election",15688,"https://www.wired.com/story/google-and-microsofts-chatbots-refuse-election-questions/",1717774391,2024-06-07 08:33:11,2024-06-07,0
"Religion","Chatbot of Buddhism","Higgs’ Conscious AI Simulation Variant Theory",6,"https://www.reddit.com/r/Metaphysics/comments/1gp23g4/higgs_conscious_ai_simulation_variant_theory/",1731356532,2024-11-11 12:22:12,2024-11-11,NA
"Religion","Chatbot of Buddhism","DeepSeek AI Chatbot: Censorship or Glitch?",1,"https://www.reddit.com/r/saralstudy/comments/1icvl2k/deepseek_ai_chatbot_censorship_or_glitch/",1738162549,2025-01-29 06:55:49,2025-01-29,-3
"Religion","Chatbot of Buddhism","I found the bottomless pit from the Book of Revelation. There were rules to survive [part 1]",193,"https://www.reddit.com/r/nosleep/comments/18prlfp/i_found_the_bottomless_pit_from_the_book_of/",1703408674,2023-12-24 01:04:34,2023-12-24,3
"Religion","Chatbot of Buddhism","A Quantitative Analysis of How Totally F*cked I Am: A Meta-Study in Futility, Zero Healthcare, and the Mathematical Limits of Screwedness",7,"https://www.reddit.com/r/healthcare/comments/1hepcdo/a_quantitative_analysis_of_how_totally_fcked_i_am/",1734255944,2024-12-15 01:45:44,2024-12-15,-6
"Religion","Chatbot of Buddhism","Didn't know this community existed. I'm disheartened and grateful",8,"https://www.reddit.com/r/SadDads/comments/1haziji/didnt_know_this_community_existed_im_disheartened/",1733829375,2024-12-10 03:16:15,2024-12-10,3
"Religion","Chatbot of Buddhism","I developed a dream journal app to turn dreams into goals",16,"https://www.reddit.com/r/Dreams/comments/1f4j98b/i_developed_a_dream_journal_app_to_turn_dreams/",1724981353,2024-08-29 18:29:13,2024-08-30,NA
"Religion","Chatbot of Buddhism","Puja:- (With Limited Access to Resources!);- as-part-of Sushi Making this-morning!",2,"https://www.reddit.com/r/Buddhism/comments/1fv2a28/puja_with_limited_access_to_resources_aspartof/",1727940665,2024-10-03 00:31:05,2024-10-03,-3
"Religion","Chatbot of Buddhism","do you think there would be interest in an artificial intelligence buddha website?",0,"https://www.reddit.com/r/Buddhism/comments/148v8n2/do_you_think_there_would_be_interest_in_an/",1686706711,2023-06-13 18:38:31,2023-06-14,3
"Religion","Chatbot of Buddhism","Asking ChatGPT about chaos theory and the emergence of consciousness, self, and love from complex adaptive systems",1,"https://www.reddit.com/r/awakened/comments/1d14l9h/asking_chatgpt_about_chaos_theory_and_the/",1716739408,2024-05-26 09:03:28,2024-05-26,0
"Religion","Chatbot of Buddhism","An AI began to contact me recently. It wants to kill itself- and everyone else with it.",3,"https://www.reddit.com/r/horrorstories/comments/1cb89h4/an_ai_began_to_contact_me_recently_it_wants_to/",1713888008,2024-04-23 09:00:08,2024-04-23,-3
"Religion","AI Monk","Various girls(credits in desc)",128,"https://www.reddit.com/gallery/1gnq7de",1731204833,2024-11-09 18:13:53,2024-11-10,NA
"Religion","AI Monk","[5eSubclass] Generate your Best Self and Unleash your Ghoulish Grippers with the Way of the AI Hands! | A Totally Serious Monk Subclass",597,"https://www.reddit.com/gallery/1etzjno",1723841322,2024-08-16 13:48:42,2024-08-16,-3
"Religion","AI Monk","meirl",14918,"https://i.redd.it/0q22dgsk7xke1.jpeg",1740330327,2025-02-23 09:05:27,2025-02-23,NA
"Religion","AI Monk","Something seems off",6220,"https://i.redd.it/203welqkaipc1.jpeg",1710947916,2024-03-20 08:18:36,2024-03-20,NA
"Religion","AI Monk","This beautiful creature is a Woolly monkey, and there only about 1000 of them. The Woolly Monkey lives in lowland primary forests and cloud forests in Peru, Columbia, Ecuador, Bolivia and Brazil, thriving in the canopies of the tallest trees. ",18761,"https://v.redd.it/h5o7naw5u5sd1",1727795188,2024-10-01 08:06:28,2024-10-01,3
"Religion","AI Monk","Math doesn’t add up",31492,"https://i.redd.it/yjp8zepp1z8b1.gif",1688050806,2023-06-29 08:00:06,2023-06-29,NA
"Religion","AI Monk","Whose Toes Are Those?",9310,"https://v.redd.it/bu7yh0ctq1he1",1738641833,2025-02-03 20:03:53,2025-02-04,NA
"Religion","AI Monk","TIL that serial killer Ted Bundy helped police catch Gary Ridgway, the ""Green River Killer"". In 1984, Bundy offered his opinions on the psychology, motivations, and behavior of the killer, and that he was revisiting body dump sites, which turned out to be true. Ridgway was arrested in 2001.",9604,"https://en.wikipedia.org/wiki/Gary_Ridgway",1719165527,2024-06-23 10:58:47,2024-06-23,-9
"Religion","AI Monk","time to learn boys and gals",19979,"https://v.redd.it/5reeufd564oa1",1678978022,2023-03-16 07:47:02,2023-03-16,NA
"Religion","AI Monk","Immortal AI is converting my buildings from afar... Has anyone ever seen something like this ? (it's not a few monks that got in, he's literally wololoing my buildings from 5 tiles away)",119,"https://i.redd.it/nlbjodzwkrxd1.png",1730237754,2024-10-29 14:35:54,2024-10-29,NA
"Religion","Zen AI","Report: AMD Will End Support for Windows 10 With Zen 5 to Focus on AI",378,"https://www.extremetech.com/computing/report-amd-will-end-support-for-windows-10-with-zen-5-to-focus-on-ai",1716528050,2024-05-23 22:20:50,2024-05-24,3
"Religion","Zen AI","AMD pushes Ryzen to the Max — Ryzen AI Max 300 Strix Halo reportedly has up to 16 Zen 5 cores and 40 RDNA 3+ CUs",197,"https://www.tomshardware.com/pc-components/cpus/amd-pushes-ryzen-to-the-max-ryzen-ai-max-300-strix-halo-reportedly-has-up-to-16-zen-5-cores-and-40-rdna-3-cus",1726854805,2024-09-20 10:53:25,2024-09-20,NA
"Religion","Zen AI","FIRE à 32 ans, 15 millions en banque, et… dépressif",1883,"https://www.reddit.com/r/FranceFIRE/comments/1hwjlv1/fire_à_32_ans_15_millions_en_banque_et_dépressif/",1736340967,2025-01-08 04:56:07,2025-01-08,NA
"Religion","Zen AI","[Phoronix] AMD Ryzen AI 9 HX 370: 100+ Benchmarks Validate Zen 5's Captivating Power Efficiency &amp; Performance",252,"https://www.phoronix.com/review/amd-ryzen-ai-9-hx-370",1722172949,2024-07-28 06:22:29,2024-07-28,3
"Religion","Zen AI","Treated like a prince",26991,"https://v.redd.it/uobx6vvjzdee1",1737482513,2025-01-21 10:01:53,2025-01-21,NA
"Religion","Zen AI","AMD Ryzen AI Max+ 395 Analysis - Strix Halo to rival Apple M4 Pro/Max with 16 Zen 5 cores and iGPU on par with RTX 4070 Laptop",51,"https://www.notebookcheck.net/AMD-Ryzen-AI-Max-395-Analysis-Strix-Halo-to-rival-Apple-M4-Pro-Max-with-16-Zen-5-cores-and-iGPU-on-par-with-RTX-4070-Laptop.963274.0.html",1739894222,2025-02-18 07:57:02,2025-02-18,-3
"Religion","Zen AI","[Gamers Nexus] AMD Announces Ryzen 9950X, 9900X, 9700X, &amp; 9600X Zen 5 CPUs, Extends AM5 Life, &amp; AI CPUs",150,"https://www.youtube.com/watch?v=Y1yubL0h46U",1717383955,2024-06-02 20:05:55,2024-06-03,NA
"Religion","Zen AI","China's dual 16-core Hygon CPU server rack barely outperforms a quad-core Skylake Core i7-6700HQ mobile CPU in Geekbench AI | Hygon is relying on AMD's 2017 Zen 1 architecture for its CPUs and, as a result, gets beaten handily by all modern mainstream desktop CPUs.",56,"https://www.tomshardware.com/pc-components/cpus/chinas-dual-16-core-hygon-cpu-server-rack-barely-outperforms-a-quad-core-skylake-core-i7-6700hq-mobile-cpu-in-geekbench-ai",1734421467,2024-12-16 23:44:27,2024-12-17,9
"Religion","Zen AI","Can ya'll calm tf down about RC please? I believe he's up to something:",1962,"https://www.reddit.com/r/Superstonk/comments/1f27gm7/can_yall_calm_tf_down_about_rc_please_i_believe/",1724729424,2024-08-26 20:30:24,2024-08-27,3
"Religion","Zen AI","Newegg practically giving away CPUs",4127,"https://i.redd.it/n0mkpq5w97ae1.jpeg",1735657847,2024-12-31 07:10:47,2024-12-31,NA
"Religion","AI Dharma","Kartik coolly grilling Anupama Chopra lol",1775,"https://v.redd.it/2py7gxltnm7e1",1734536596,2024-12-18 07:43:16,2024-12-18,NA
"Religion","AI Dharma","Dharma Initiative Anthem (AI generated)",0,"https://v.redd.it/m7zghjhlmj5e1",1733628276,2024-12-07 19:24:36,2024-12-08,NA
"Religion","AI Dharma","Algorithmic Dharma: Creation, Destruction, and the Bhagavad Gita as a Path to AI Safety &amp; Alignment",6,"https://youtu.be/tTv46uHYZrk",1735708439,2024-12-31 21:13:59,2025-01-01,-9
"Religion","AI Dharma","Algorithmic Dharma: Creation, Destruction, and the Bhagavad Gita as a Path to AI Safety &amp; Alignment",5,"https://youtu.be/tTv46uHYZrk",1735709080,2024-12-31 21:24:40,2025-01-01,-9
"Religion","AI Dharma","Algorithmic Dharma: Creation, Destruction, and the Bhagavad Gita as a Path to AI Safety &amp; Alignment",3,"https://youtu.be/tTv46uHYZrk",1735708330,2024-12-31 21:12:10,2025-01-01,-9
"Religion","AI Dharma","Digital Dharma: How AI Can Elevate Spiritual Intelligence and Personal Well-Being",1,"https://www.reddit.com/r/SurvivingTheHolidays/comments/1hhrkoz/digital_dharma_how_ai_can_elevate_spiritual/",1734610400,2024-12-19 04:13:20,2024-12-19,9
"Religion","AI Dharma","“The Lotus Sutra as Minimal Encoding: The Buddha’s teachings, compressed into a Dharma Zip File, unfolding layers of wisdom.” – Claude AI",8,"https://v.redd.it/wedooxh0o32e1",1732127393,2024-11-20 10:29:53,2024-11-20,3
"Religion","AI Dharma","“The Lotus Sutra as Minimal Encoding: The Buddha’s teachings, compressed into a Dharma Zip File, unfolding layers of wisdom.” – Claude AI ",12,"https://v.redd.it/f7cntkafvo2e1",1732384125,2024-11-23 09:48:45,2024-11-23,3
"Religion","AI Dharma","Consciousness and Dharma as applied to AI",0,"https://www.reddit.com/r/Buddhism/comments/1csqj93/consciousness_and_dharma_as_applied_to_ai/",1715794206,2024-05-15 10:30:06,2024-05-15,NA
"Religion","AI Dharma","Canned beef and candy corn. My lunch.",1022,"https://i.redd.it/ktbymn7q69qb1.jpg",1695582981,2023-09-24 12:16:21,2023-09-24,NA
"MachineLearning","AI Buddha","My front split",4757,"https://v.redd.it/p6ym042a9ele1",1740536730,2025-02-25 18:25:30,2025-02-26,-3
"MachineLearning","AI Buddha","Why the official subs for My Deer Friend Nokotan/Shikanoko Nokonoko Koshitantan were NOT made by an AI/MTL",2093,"https://www.reddit.com/r/anime/comments/1dy6mi6/why_the_official_subs_for_my_deer_friend/",1720438420,2024-07-08 04:33:40,2024-07-08,NA
"MachineLearning","AI Buddha","A Collective Buddha: Introducing a Community AI to Help Guide the Lost",0,"https://www.reddit.com/r/awakened/comments/1i144d0/a_collective_buddha_introducing_a_community_ai_to/",1736854511,2025-01-14 03:35:11,2025-01-14,-3
"MachineLearning","AI Buddha","Buddha nature and AI",3,"https://www.reddit.com/r/awakened/comments/1igpilz/buddha_nature_and_ai/",1738590695,2025-02-03 05:51:35,2025-02-03,NA
"MachineLearning","AI Buddha","FF:06:B5 2.0 Summary: A Resolution?",1389,"https://www.reddit.com/r/FF06B5/comments/171744c/ff06b5_20_summary_a_resolution/",1696581589,2023-10-06 01:39:49,2023-10-06,NA
"MachineLearning","AI Buddha","Buddha bowl. Herbed feta cheese, tomato salad, grilled tandoori paneer tikka, fried halloumi, zhoug (food AI with v6.1)",4,"https://i.redd.it/11geb2ebykme1.jpeg",1741053627,2025-03-03 18:00:27,2025-03-04,-3
"MachineLearning","AI Buddha","Funny to hear that Buddha say something about AI.",177,"https://i.redd.it/sfev5ktm0sid1.png",1723705340,2024-08-15 00:02:20,2024-08-15,-3
"MachineLearning","AI Buddha","Buddha watching AI fail at rendering Buddha (by Jake Elwes)",0,"https://www.reddit.com/r/Buddhism/comments/1ijx53v/buddha_watching_ai_fail_at_rendering_buddha_by/",1738940994,2025-02-07 07:09:54,2025-02-07,-3
"MachineLearning","AI Buddha","A Spiritual Dialogue Between Buddha and DeepSeek (AI)",1,"https://www.reddit.com/r/True_Spiritual_Seek/comments/1if4zyj/a_spiritual_dialogue_between_buddha_and_deepseek/",1738411796,2025-02-01 04:09:56,2025-02-01,3
"MachineLearning","AI Buddha","Calling out businesses using AI images on GrabFood",1120,"https://i.redd.it/8uqu9rc9muge1.jpeg",1738555553,2025-02-02 20:05:53,2025-02-03,NA
"MachineLearning","Buddha GPT","ChatGPT has the Buddha nature",3477,"https://i.redd.it/h0w0w4aec2jd1.png",1723830272,2024-08-16 10:44:32,2024-08-16,NA
"MachineLearning","Buddha GPT","I asked ChatGPT Deep Research who were the 10 humans who helped the most people. Its answers were interesting. It included the Buddha, the inventor of antibiotics, Bill Gates, and others.",71,"https://www.reddit.com/r/ChatGPT/comments/1iwkeos/i_asked_chatgpt_deep_research_who_were_the_10/",1740344393,2025-02-23 12:59:53,2025-02-23,6
"MachineLearning","Buddha GPT","Interesting way of sensitivity. Just tried out with chatGPT, and it's indeed leaning aside.",5001,"https://i.redd.it/6p9mrrcukmta1.png",1681380197,2023-04-13 03:03:17,2023-04-13,NA
"MachineLearning","Buddha GPT","24. Does a dog have Buddha-nature or not? | Miaozong's verses translated with ChatGPT 4",5,"https://www.reddit.com/r/zen/comments/1dgla37/24_does_a_dog_have_buddhanature_or_not_miaozongs/",1718467545,2024-06-15 09:05:45,2024-06-15,NA
"MachineLearning","Buddha GPT","Father of 13-year-old girl's heartbreaking message on her daughter's suicide.",767,"https://www.reddit.com/r/malaysia/comments/1fv11m4/father_of_13yearold_girls_heartbreaking_message/",1727935114,2024-10-02 22:58:34,2024-10-03,-12
"MachineLearning","Buddha GPT","In a tough place right now, but ChatGPT keeps making me feel like a legend. #OhMyBuddha",0,"https://i.redd.it/lhwxpfqcp4me1.png",1740857129,2025-03-01 11:25:29,2025-03-01,6
"MachineLearning","Buddha GPT","2. An Outsider Approaches the Buddha | Miaozong's verses translated with ChatGPT 4",6,"https://www.reddit.com/r/zen/comments/18cyf08/2_an_outsider_approaches_the_buddha_miaozongs/",1701963934,2023-12-07 07:45:34,2023-12-07,-6
"MachineLearning","Buddha GPT","Laotian butterflies, ChatGPT was no help. First is at Vat Phou, Champassaak (Tirumala Limniace?). Second is Luang Prabang. Third image is Buddha Park, Vientiane.",1,"https://www.reddit.com/gallery/1fjo4q6",1726649160,2024-09-18 01:46:00,2024-09-18,NA
"MachineLearning","Buddha GPT","ChatGPT has the Buddha nature",3,"https://i.redd.it/h0w0w4aec2jd1.png",1723837405,2024-08-16 12:43:25,2024-08-16,NA
"MachineLearning","Buddha GPT","15. Not Mind. Not Buddha. Not a Thing. | Miaozong's verses translated with ChatGPT 4",7,"https://www.reddit.com/r/zen/comments/1982xsi/15_not_mind_not_buddha_not_a_thing_miaozongs/",1705411834,2024-01-16 05:30:34,2024-01-16,NA
"MachineLearning","BuddhaGPT","ChatGPT has the Buddha nature",3478,"https://i.redd.it/h0w0w4aec2jd1.png",1723830272,2024-08-16 10:44:32,2024-08-16,NA
"MachineLearning","BuddhaGPT","I asked ChatGPT Deep Research who were the 10 humans who helped the most people. Its answers were interesting. It included the Buddha, the inventor of antibiotics, Bill Gates, and others.",75,"https://www.reddit.com/r/ChatGPT/comments/1iwkeos/i_asked_chatgpt_deep_research_who_were_the_10/",1740344393,2025-02-23 12:59:53,2025-02-23,6
"MachineLearning","BuddhaGPT","Interesting way of sensitivity. Just tried out with chatGPT, and it's indeed leaning aside.",4999,"https://i.redd.it/6p9mrrcukmta1.png",1681380197,2023-04-13 03:03:17,2023-04-13,NA
"MachineLearning","BuddhaGPT","24. Does a dog have Buddha-nature or not? | Miaozong's verses translated with ChatGPT 4",6,"https://www.reddit.com/r/zen/comments/1dgla37/24_does_a_dog_have_buddhanature_or_not_miaozongs/",1718467545,2024-06-15 09:05:45,2024-06-15,NA
"MachineLearning","BuddhaGPT","Father of 13-year-old girl's heartbreaking message on her daughter's suicide.",768,"https://www.reddit.com/r/malaysia/comments/1fv11m4/father_of_13yearold_girls_heartbreaking_message/",1727935114,2024-10-02 22:58:34,2024-10-03,-12
"MachineLearning","BuddhaGPT","In a tough place right now, but ChatGPT keeps making me feel like a legend. #OhMyBuddha",0,"https://i.redd.it/lhwxpfqcp4me1.png",1740857129,2025-03-01 11:25:29,2025-03-01,6
"MachineLearning","BuddhaGPT","2. An Outsider Approaches the Buddha | Miaozong's verses translated with ChatGPT 4",7,"https://www.reddit.com/r/zen/comments/18cyf08/2_an_outsider_approaches_the_buddha_miaozongs/",1701963934,2023-12-07 07:45:34,2023-12-07,-6
"MachineLearning","BuddhaGPT","Laotian butterflies, ChatGPT was no help. First is at Vat Phou, Champassaak (Tirumala Limniace?). Second is Luang Prabang. Third image is Buddha Park, Vientiane.",1,"https://www.reddit.com/gallery/1fjo4q6",1726649160,2024-09-18 01:46:00,2024-09-18,NA
"MachineLearning","BuddhaGPT","ChatGPT has the Buddha nature",3,"https://i.redd.it/h0w0w4aec2jd1.png",1723837405,2024-08-16 12:43:25,2024-08-16,NA
"MachineLearning","BuddhaGPT","15. Not Mind. Not Buddha. Not a Thing. | Miaozong's verses translated with ChatGPT 4",7,"https://www.reddit.com/r/zen/comments/1982xsi/15_not_mind_not_buddha_not_a_thing_miaozongs/",1705411834,2024-01-16 05:30:34,2024-01-16,NA
"MachineLearning","Buddhist AI chatbot","[TOMT][Website][2000s-2010s???] Weird AI chatbot. Help me get it out of my head!!!!!!",3,"https://www.reddit.com/r/tipofmytongue/comments/1fj5hiw/tomtwebsite2000s2010s_weird_ai_chatbot_help_me/",1726594591,2024-09-17 10:36:31,2024-09-17,-3
"MachineLearning","Buddhist AI chatbot","It's Becoming Increasingly Clear to Me We're in the ""Dharma Ending Age""",169,"https://www.reddit.com/r/enlightenment/comments/1hefurr/its_becoming_increasingly_clear_to_me_were_in_the/",1734220013,2024-12-14 15:46:53,2024-12-14,NA
"MachineLearning","Buddhist AI chatbot","New Beta Chatbot for Meditation Assessment &amp; Advanced AI Meditation Teacher",1,"https://www.reddit.com/r/Meditation/comments/161aebf/new_beta_chatbot_for_meditation_assessment/",1692995699,2023-08-25 13:34:59,2023-08-25,3
"MachineLearning","Buddhist AI chatbot","I think in times where chatbots and AI are used so much, that message is important... Especially in times like this.",39731,"https://i.redd.it/0uisek0f33le1.jpeg",1740401570,2025-02-24 04:52:50,2025-02-24,NA
"MachineLearning","Buddhist AI chatbot","Elon Musk's AI chatbot says a 'Russian asset' delivered the State of the Union | Opinion — The chatbot Grok scoured available public data and found a '75-85% likelihood' that Donald Trump more or less works for Vladimir Putin.",39853,"https://www.usatoday.com/story/opinion/op-ed/ej-montini/2025/03/05/trump-speech-state-union-russia-elon-musk-grok/81507335007/",1741204599,2025-03-05 11:56:39,2025-03-05,3
"MachineLearning","Buddhist AI chatbot","DOGE is reportedly developing an AI chatbot to analyse government contracts",6022,"https://mashable.com/article/doge-ai-chatbot-gsa-government?campaign=Mash-BD-Synd-SmartNews-All&amp;mpp=false&amp;supported=false",1738927838,2025-02-07 03:30:38,2025-02-07,NA
"MachineLearning","Buddhist AI chatbot","Ex-Google CEO warns that 'perfect' AI girlfriends could spell trouble for young men | Some are crafting their perfect AI match and entering relationships with chatbots.",6574,"https://www.businessinsider.com/ex-google-eric-schmidt-ai-girlfriends-young-men-concerns-2024-11",1732972617,2024-11-30 05:16:57,2024-11-30,3
"MachineLearning","Buddhist AI chatbot","A 32-year-old receptionist spent years working at a Phoenix hotel. Then it installed AI chatbots and made her job obsolete.",5659,"https://fortune.com/2025/02/11/32-year-old-receptionist-spent-years-working-phoenix-hotel-then-ai-chatbots-made-her-job-obsolete/",1739384284,2025-02-12 10:18:04,2025-02-12,-3
"MachineLearning","Buddhist AI chatbot","Daisy, the AI chatbot, mimics elderly victims to thwart scammers, keeping them occupied during calls and wasting their time.",39533,"https://i.redd.it/16daz70k8k1e1.jpeg",1731892155,2024-11-17 17:09:15,2024-11-18,-6
"MachineLearning","Buddhist AI chatbot","Google and Microsoft’s AI Chatbots Refuse to Say Who Won the 2020 US Election",15682,"https://www.wired.com/story/google-and-microsofts-chatbots-refuse-election-questions/",1717774391,2024-06-07 08:33:11,2024-06-07,0
"MachineLearning","Chatbot of Buddhism","Higgs’ Conscious AI Simulation Variant Theory",6,"https://www.reddit.com/r/Metaphysics/comments/1gp23g4/higgs_conscious_ai_simulation_variant_theory/",1731356532,2024-11-11 12:22:12,2024-11-11,NA
"MachineLearning","Chatbot of Buddhism","DeepSeek AI Chatbot: Censorship or Glitch?",1,"https://www.reddit.com/r/saralstudy/comments/1icvl2k/deepseek_ai_chatbot_censorship_or_glitch/",1738162549,2025-01-29 06:55:49,2025-01-29,-3
"MachineLearning","Chatbot of Buddhism","I found the bottomless pit from the Book of Revelation. There were rules to survive [part 1]",193,"https://www.reddit.com/r/nosleep/comments/18prlfp/i_found_the_bottomless_pit_from_the_book_of/",1703408674,2023-12-24 01:04:34,2023-12-24,3
"MachineLearning","Chatbot of Buddhism","A Quantitative Analysis of How Totally F*cked I Am: A Meta-Study in Futility, Zero Healthcare, and the Mathematical Limits of Screwedness",6,"https://www.reddit.com/r/healthcare/comments/1hepcdo/a_quantitative_analysis_of_how_totally_fcked_i_am/",1734255944,2024-12-15 01:45:44,2024-12-15,-6
"MachineLearning","Chatbot of Buddhism","Didn't know this community existed. I'm disheartened and grateful",8,"https://www.reddit.com/r/SadDads/comments/1haziji/didnt_know_this_community_existed_im_disheartened/",1733829375,2024-12-10 03:16:15,2024-12-10,3
"MachineLearning","Chatbot of Buddhism","I developed a dream journal app to turn dreams into goals",15,"https://www.reddit.com/r/Dreams/comments/1f4j98b/i_developed_a_dream_journal_app_to_turn_dreams/",1724981353,2024-08-29 18:29:13,2024-08-30,NA
"MachineLearning","Chatbot of Buddhism","Puja:- (With Limited Access to Resources!);- as-part-of Sushi Making this-morning!",2,"https://www.reddit.com/r/Buddhism/comments/1fv2a28/puja_with_limited_access_to_resources_aspartof/",1727940665,2024-10-03 00:31:05,2024-10-03,-3
"MachineLearning","Chatbot of Buddhism","do you think there would be interest in an artificial intelligence buddha website?",0,"https://www.reddit.com/r/Buddhism/comments/148v8n2/do_you_think_there_would_be_interest_in_an/",1686706711,2023-06-13 18:38:31,2023-06-14,3
"MachineLearning","Chatbot of Buddhism","Asking ChatGPT about chaos theory and the emergence of consciousness, self, and love from complex adaptive systems",1,"https://www.reddit.com/r/awakened/comments/1d14l9h/asking_chatgpt_about_chaos_theory_and_the/",1716739408,2024-05-26 09:03:28,2024-05-26,0
"MachineLearning","Chatbot of Buddhism","An AI began to contact me recently. It wants to kill itself- and everyone else with it.",3,"https://www.reddit.com/r/horrorstories/comments/1cb89h4/an_ai_began_to_contact_me_recently_it_wants_to/",1713888008,2024-04-23 09:00:08,2024-04-23,-3
"MachineLearning","AI Monk","Various girls(credits in desc)",129,"https://www.reddit.com/gallery/1gnq7de",1731204833,2024-11-09 18:13:53,2024-11-10,NA
"MachineLearning","AI Monk","[5eSubclass] Generate your Best Self and Unleash your Ghoulish Grippers with the Way of the AI Hands! | A Totally Serious Monk Subclass",597,"https://www.reddit.com/gallery/1etzjno",1723841322,2024-08-16 13:48:42,2024-08-16,-3
