"platform","keyword","text","score","post_id","created_utc","timestamp","date","sentiment_score"
"MachineLearning","AI Monk","meirl",14917,"https://i.redd.it/0q22dgsk7xke1.jpeg",1740330327,2025-02-23 09:05:27,2025-02-23,NA
"MachineLearning","AI Monk","Something seems off",6215,"https://i.redd.it/203welqkaipc1.jpeg",1710947916,2024-03-20 08:18:36,2024-03-20,NA
"MachineLearning","AI Monk","This beautiful creature is a Woolly monkey, and there only about 1000 of them. The Woolly Monkey lives in lowland primary forests and cloud forests in Peru, Columbia, Ecuador, Bolivia and Brazil, thriving in the canopies of the tallest trees. ",18767,"https://v.redd.it/h5o7naw5u5sd1",1727795188,2024-10-01 08:06:28,2024-10-01,3
"MachineLearning","AI Monk","Math doesn’t add up",31488,"https://i.redd.it/yjp8zepp1z8b1.gif",1688050806,2023-06-29 08:00:06,2023-06-29,NA
"MachineLearning","AI Monk","Whose Toes Are Those?",9300,"https://v.redd.it/bu7yh0ctq1he1",1738641833,2025-02-03 20:03:53,2025-02-04,NA
"MachineLearning","AI Monk","TIL that serial killer Ted Bundy helped police catch Gary Ridgway, the ""Green River Killer"". In 1984, Bundy offered his opinions on the psychology, motivations, and behavior of the killer, and that he was revisiting body dump sites, which turned out to be true. Ridgway was arrested in 2001.",9600,"https://en.wikipedia.org/wiki/Gary_Ridgway",1719165527,2024-06-23 10:58:47,2024-06-23,-9
"MachineLearning","AI Monk","time to learn boys and gals",19980,"https://v.redd.it/5reeufd564oa1",1678978022,2023-03-16 07:47:02,2023-03-16,NA
"MachineLearning","AI Monk","Immortal AI is converting my buildings from afar... Has anyone ever seen something like this ? (it's not a few monks that got in, he's literally wololoing my buildings from 5 tiles away)",120,"https://i.redd.it/nlbjodzwkrxd1.png",1730237754,2024-10-29 14:35:54,2024-10-29,NA
"MachineLearning","Zen AI","Report: AMD Will End Support for Windows 10 With Zen 5 to Focus on AI",377,"https://www.extremetech.com/computing/report-amd-will-end-support-for-windows-10-with-zen-5-to-focus-on-ai",1716528050,2024-05-23 22:20:50,2024-05-24,3
"MachineLearning","Zen AI","AMD pushes Ryzen to the Max — Ryzen AI Max 300 Strix Halo reportedly has up to 16 Zen 5 cores and 40 RDNA 3+ CUs",195,"https://www.tomshardware.com/pc-components/cpus/amd-pushes-ryzen-to-the-max-ryzen-ai-max-300-strix-halo-reportedly-has-up-to-16-zen-5-cores-and-40-rdna-3-cus",1726854805,2024-09-20 10:53:25,2024-09-20,NA
"MachineLearning","Zen AI","FIRE à 32 ans, 15 millions en banque, et… dépressif",1891,"https://www.reddit.com/r/FranceFIRE/comments/1hwjlv1/fire_à_32_ans_15_millions_en_banque_et_dépressif/",1736340967,2025-01-08 04:56:07,2025-01-08,NA
"MachineLearning","Zen AI","[Phoronix] AMD Ryzen AI 9 HX 370: 100+ Benchmarks Validate Zen 5's Captivating Power Efficiency &amp; Performance",248,"https://www.phoronix.com/review/amd-ryzen-ai-9-hx-370",1722172949,2024-07-28 06:22:29,2024-07-28,3
"MachineLearning","Zen AI","Treated like a prince",27000,"https://v.redd.it/uobx6vvjzdee1",1737482513,2025-01-21 10:01:53,2025-01-21,NA
"MachineLearning","Zen AI","AMD Ryzen AI Max+ 395 Analysis - Strix Halo to rival Apple M4 Pro/Max with 16 Zen 5 cores and iGPU on par with RTX 4070 Laptop",53,"https://www.notebookcheck.net/AMD-Ryzen-AI-Max-395-Analysis-Strix-Halo-to-rival-Apple-M4-Pro-Max-with-16-Zen-5-cores-and-iGPU-on-par-with-RTX-4070-Laptop.963274.0.html",1739894222,2025-02-18 07:57:02,2025-02-18,-3
"MachineLearning","Zen AI","[Gamers Nexus] AMD Announces Ryzen 9950X, 9900X, 9700X, &amp; 9600X Zen 5 CPUs, Extends AM5 Life, &amp; AI CPUs",149,"https://www.youtube.com/watch?v=Y1yubL0h46U",1717383955,2024-06-02 20:05:55,2024-06-03,NA
"MachineLearning","Zen AI","China's dual 16-core Hygon CPU server rack barely outperforms a quad-core Skylake Core i7-6700HQ mobile CPU in Geekbench AI | Hygon is relying on AMD's 2017 Zen 1 architecture for its CPUs and, as a result, gets beaten handily by all modern mainstream desktop CPUs.",56,"https://www.tomshardware.com/pc-components/cpus/chinas-dual-16-core-hygon-cpu-server-rack-barely-outperforms-a-quad-core-skylake-core-i7-6700hq-mobile-cpu-in-geekbench-ai",1734421467,2024-12-16 23:44:27,2024-12-17,9
"MachineLearning","Zen AI","Can ya'll calm tf down about RC please? I believe he's up to something:",1966,"https://www.reddit.com/r/Superstonk/comments/1f27gm7/can_yall_calm_tf_down_about_rc_please_i_believe/",1724729424,2024-08-26 20:30:24,2024-08-27,3
"MachineLearning","Zen AI","Newegg practically giving away CPUs",4121,"https://i.redd.it/n0mkpq5w97ae1.jpeg",1735657847,2024-12-31 07:10:47,2024-12-31,NA
"MachineLearning","AI Dharma","Kartik coolly grilling Anupama Chopra lol",1772,"https://v.redd.it/2py7gxltnm7e1",1734536596,2024-12-18 07:43:16,2024-12-18,NA
"MachineLearning","AI Dharma","Dharma Initiative Anthem (AI generated)",0,"https://v.redd.it/m7zghjhlmj5e1",1733628276,2024-12-07 19:24:36,2024-12-08,NA
"MachineLearning","AI Dharma","Algorithmic Dharma: Creation, Destruction, and the Bhagavad Gita as a Path to AI Safety &amp; Alignment",5,"https://youtu.be/tTv46uHYZrk",1735708439,2024-12-31 21:13:59,2025-01-01,-9
"MachineLearning","AI Dharma","Algorithmic Dharma: Creation, Destruction, and the Bhagavad Gita as a Path to AI Safety &amp; Alignment",6,"https://youtu.be/tTv46uHYZrk",1735709080,2024-12-31 21:24:40,2025-01-01,-9
"MachineLearning","AI Dharma","Algorithmic Dharma: Creation, Destruction, and the Bhagavad Gita as a Path to AI Safety &amp; Alignment",2,"https://youtu.be/tTv46uHYZrk",1735708330,2024-12-31 21:12:10,2025-01-01,-9
"MachineLearning","AI Dharma","Digital Dharma: How AI Can Elevate Spiritual Intelligence and Personal Well-Being",1,"https://www.reddit.com/r/SurvivingTheHolidays/comments/1hhrkoz/digital_dharma_how_ai_can_elevate_spiritual/",1734610400,2024-12-19 04:13:20,2024-12-19,9
"MachineLearning","AI Dharma","“The Lotus Sutra as Minimal Encoding: The Buddha’s teachings, compressed into a Dharma Zip File, unfolding layers of wisdom.” – Claude AI",7,"https://v.redd.it/wedooxh0o32e1",1732127393,2024-11-20 10:29:53,2024-11-20,3
"MachineLearning","AI Dharma","“The Lotus Sutra as Minimal Encoding: The Buddha’s teachings, compressed into a Dharma Zip File, unfolding layers of wisdom.” – Claude AI ",13,"https://v.redd.it/f7cntkafvo2e1",1732384125,2024-11-23 09:48:45,2024-11-23,3
"MachineLearning","AI Dharma","Consciousness and Dharma as applied to AI",0,"https://www.reddit.com/r/Buddhism/comments/1csqj93/consciousness_and_dharma_as_applied_to_ai/",1715794206,2024-05-15 10:30:06,2024-05-15,NA
"MachineLearning","AI Dharma","Canned beef and candy corn. My lunch.",1025,"https://i.redd.it/ktbymn7q69qb1.jpg",1695582981,2023-09-24 12:16:21,2023-09-24,NA
